{
  "$schema": "https://json-schema.org/draft/2020-12/schema",
  "$id": "https://openbindings.com/schema/transforms-conformance-fixture-0.2.0.json",
  "title": "transform implementation-observation fixture file",
  "description": "Historical JSONata implementation outcomes. These observations do not define language requirements or official-library fidelity guarantees. Authority-linked semantic cases live in language/. An outcome envelope distinguishes undefined from null.",
  "type": "object",
  "required": ["kind", "language", "expectedEngine", "cases"],
  "properties": {
    "kind": { "enum": ["agree", "known-divergence"] },
    "language": { "const": "jsonata" },
    "expectedEngine": {
      "type": "string",
      "description": "The engine that produced the recorded `expected` outcomes (jsonata-js@2.1.1); this is provenance, not normative authority."
    },
    "actualEngine": {
      "type": "string",
      "description": "known-divergence only: the engine that produced every `actual` outcome (e.g. gnata@0.2.2)."
    },
    "description": { "type": "string" },
    "rootCauses": {
      "type": "object",
      "description": "known-divergence only: prose for each root-cause label used by a case.",
      "additionalProperties": { "type": "string" }
    },
    "cases": {
      "type": "array",
      "minItems": 1,
      "items": { "$ref": "#/$defs/case" }
    }
  },
  "additionalProperties": false,
  "allOf": [
    {
      "if": { "properties": { "kind": { "const": "known-divergence" } } },
      "then": {
        "properties": {
          "cases": {
            "type": "array",
            "items": {
              "type": "object",
              "required": ["rootCause", "actual"]
            }
          }
        }
      }
    }
  ],
  "$defs": {
    "outcome": {
      "type": "object",
      "description": "The result of evaluating `expr` against `input`. `value` carries any JSON value; `status: undefined` is JSONata's no-result signal (distinct from a null value); `status: error` records only a message substring, since exact error text is engine-specific. `orderNondeterministic` (an `actual` only) marks a value whose array-element ORDER varies per process — compared as a multiset, never positionally.",
      "required": ["status"],
      "properties": {
        "status": { "enum": ["value", "undefined", "error"] },
        "value": {},
        "errorContains": { "type": "string" },
        "orderNondeterministic": { "type": "boolean" }
      },
      "additionalProperties": false
    },
    "case": {
      "type": "object",
      "required": ["id", "description", "expr", "input", "expected"],
      "properties": {
        "id": { "type": "string" },
        "rootCause": {
          "enum": ["W", "F", "M", "R"],
          "description": "known-divergence only: which root-cause pattern this case exercises."
        },
        "description": { "type": "string" },
        "expr": { "type": "string", "description": "The JSONata expression under test." },
        "input": { "description": "The JSON value the expression evaluates against (JSONata's context, $)." },
        "expected": { "$ref": "#/$defs/outcome" },
        "actual": {
          "$ref": "#/$defs/outcome",
          "description": "known-divergence only: the implementation-engine outcome."
        }
      },
      "additionalProperties": false
    }
  }
}
